case_id,query,semantic_focus,exact_models,accuracy,mean_score,mean_aligned_cell_accuracy,row_count_mismatch_models,same_count_but_wrong_models,order_only,type_only,column_error,dominant_failure_mode,note
pass5.query1,Q1,Q1 expression features,0,0.0,0.0,0.3703703703703704,1,8,0,0,0,same_count_wrong_values,"Sample-only expression feature engineering; failures usually come from log2 transforms, ratio denominators, or rounding."
pass5.query2,Q2,Q2 weighted VAF,0,0.0,0.0,0.3878600823045268,7,2,0,0,0,row_count_mismatch,Complete-chain matched expression and weighted VAF per call; models must map gene-specific expression and keep only matched calls.
pass5.query3,Q3,Q3 condition stats,0,0.0,0.0,0.34650205761316877,8,1,0,0,0,row_count_mismatch,"Condition/gene statistical summary; hard parts are complete-chain filtering, expression mapping, median, and population standard deviation."
pass5.query4,Q4,Q4 stress delta,0,0.0,0.0,0.2314814814814815,1,8,0,0,0,same_count_wrong_values,Stress-vs-control log2 marker deltas; failures tend to average before transforming or group high_light/drought incorrectly.
pass5.query5,Q5,Q5 pathway burden,0,0.0,0.0,0.32499999999999996,5,4,0,0,0,row_count_mismatch,"Non-reference pathway/tissue burden score; models must combine complete-chain filtering, VAF, log2 expression, and grouped summation."
pass5.query6,Q6,Q6 sample z-score,0,0.0,0.0,0.17777777777777778,3,6,0,0,0,same_count_wrong_values,Sample-level expression z-scores; models must use population standard deviation and sort by the derived mean score.
pass5.query7,Q7,Q7 condition CV,0,0.0,0.0,0.35555555555555557,1,8,0,0,0,same_count_wrong_values,Condition-level integrative summary; the coefficient of variation and mean VAF require correct complete-chain fact-row weighting.
pass5.query8,Q8,Q8 variant pressure,0,0.0,0.0,0.4444444444444444,1,8,0,0,0,same_count_wrong_values,Sample-level photosynthesis burden table; failures usually involve preserving zero-call samples and applying the high/moderate pressure formula.
